"url"	"urlid"	"boilerplate"	"alchemy_category"	"alchemy_category_score"	"avglinksize"	"commonlinkratio_1"	"commonlinkratio_2"	"commonlinkratio_3"	"commonlinkratio_4"	"compression_ratio"	"embed_ratio"	"framebased"	"frameTagRatio"	"hasDomainLink"	"html_ratio"	"image_ratio"	"is_news"	"lengthyLinkDomain"	"linkwordscore"	"news_front_page"	"non_markup_alphanum_characters"	"numberOfLinks"	"numwords_in_url"	"parametrizedLinkRatio"	"spelling_errors_ratio"	"label"
"http://canarygirl.com/?p=302"	"4064"	"{""title"":""canarygirl com I am a Pickle Ho And I think I Like it "",""body"":""Holy mother of mothers folks I don t know if you know this about me but I freaking LOVE pickles Not just any pickles mind you Claussen Garlic Dills to be precise My friends can attest to the fact that I have tried my hand many a time at trying to make said pickles and failed miserably Every Single Time You see I am totally canningtoddid and just well let s just say a lost cause with the whole damned thing Of course do you think that deters the otherabled canner in me Hellllll no Every once in a while I muster up the gumption to give it another try It can t be that hard I say Everybody freaking cans stuff and it looks beautiful and tastes delicious and they get to have beautiful garden goodies in the middle of freezing their asses off wintertime Why can t I And so the diligent preparing ensues boiling of jars and lids carefully measuring out vinegar salt and other ingredients to add to my dear vegetables who await their tangy arrival patiently in those sanitized recipients Every time I am left waiting waiting waiting to try the finished product And every time I have been rewarded punished with the same results Soggy mushy greyish flavorless crap Until this week I don t know WHO this person is on Recipezaar Bonnie Young but I think I may just love her Forever She is my pickle recipe posting savior While the recipe isn t exactly Claussen s it s darned close And the pickles are crunchy CRUNCHY I tell you And garlicky And perfectly lovely And are going to be my downfall because I have already eaten almost a whole jar Can you say water retention I can And I don t give a shit either I am going to make these pickles all the time now I can t wait to try it with beans cauliflower pearl onions a mixture of all of the above whatever I can get my pickly little fingers on So here it is folks Pickle Heaven Ingredients 2 quarts cucumbers1 3 cup instant minced onion6 garlic cloves minced1 2 tablespoon mustard seeds1 4 cup dill weed3 cups water1 cup white wine vinegar1 4 cup canning salta few chili peppers thrown in for good measure Preparation Slice up your cucumbers into long wedges and fill prepared jars sterilized jars and lids Add a bunch of dill to each jar Heat vinegar and water with remaining ingredients just long enough to dissolve salt Cool this mixture to room temp and then pour into jars up to the rim Cover and refrigerate at least 3 days These were good after 2 days but are even better now after a week Apparently they keep for a year in the fridge I won t find that out because ain t no WAY they ll last that long in mine lmfao Tags cucumbers gluten free recipes vegetables 29 Comments "",""url"":""canarygirl p 302""}"	"recreation"	"0.487492"	"2.086956522"	"0.498194946"	"0.202166065"	"0.028880866"	"0.02166065"	"0.510095238"	"0.00204918"	"0"	"0.008849558"	"0"	"0.233007607"	"0.100409836"	"1"	"1"	"22"	"1"	"8366"	"277"	"0"	"0.523465704"	"0.124726477"	"1"
"http://www.refinery29.com/holiday-nail-art-diy/slideshow"	"8138"	"{""title"":""Photo 1 Festive Funky Holiday Nail Art DIYs festive & funky holiday nail art diys"",""body"":""Festive Funky Holiday Nail Art DIYs Snowfall Global warming be damned Just because it s still 60 degrees out doesn t mean you can t have a white holiday This charming design showcases fluffy flakes in all their frosty glory You ll need a sparkly blue nail polish an opaque white polish and a nail art brush Photographed by Tracy Wang view photo 1- festive & funky holiday nail art diys nail art, holiday nail trends, holiday nail polish, holiday nail polish colors do you hear those sleigh bells jingling? they can only mean one thing: it's time for a new round of holiday-inspired nail art! hold on, we know what you're thinking. hello cheesy snowman and reindeer. but don't you know us better than that by now? we dreamed up three super-cool designs&hellip;"",""url"":""refinery29 holiday nail art diy slideshow""}"	"?"	"?"	"1.76969697"	"0.381818182"	"0.181818182"	"0.048484848"	"0.006060606"	"0.596837945"	"0"	"0"	"0.072669826"	"0"	"0.203740299"	"0.413533835"	"1"	"1"	"54"	"0"	"1200"	"165"	"5"	"0.139393939"	"0.06122449"	"0"
"http://www.everydayhealth.com/high-cholesterol-pictures/power-foods-for-lower-cholesterol.aspx"	"383"	"{""url"":""everydayhealth high cholesterol pictures power foods for lower cholesterol aspx"",""title"":""11 Power Foods for Lower Cholesterol High Cholesterol Center 11 power foods for lower cholesterol - high cholesterol center - everyday health"",""body"":""Oils 6 image While butter and other solid fats raise cholesterol the unsaturated fats in oils help lower it Polyunsaturated fats found primarily in corn safflower sesame soybean and sunflower oil slash LDL cholesterol Monounsaturated fats found mainly in olive avocado and canola oil not only lower LDL but may also raise HDL Try this Cook with oils instead of butter mix them with vinegar for salad dressing or drizzle them along with herbs and spices on vegetables before roasting Moderation is key since oil is high in fat and calories Stick to about 1 teaspoon with each meal advises American Dietetic Association spokesperson Toby Smithson RD lower cholesterol naturally by eating more high-fiber cholesterol-lowering foods to reduce ldl cholesterol, make your heart healthier, and reduce heart disease risk. lower cholesterol, lower ldl cholesterol, cholesterol foods, foods to lower cholesterol, soluble fiber lower cholesterol naturally by eating more high-fiber cholesterol-lowering foods to reduce ldl cholesterol, make your heart healthier, and reduce heart disease risk.""}"	"health"	"0.802314"	"1.783333333"	"0.214285714"	"0.071428571"	"0.014285714"	"0"	"0.445471349"	"0"	"0"	"0.070116861"	"1"	"0.258761956"	"0.314814815"	"1"	"1"	"5"	"0"	"9309"	"70"	"8"	"0.114285714"	"0.06185567"	"1"
"http://sportsillustrated.cnn.com/2011_swimsuit/action/alyssa-miller/11_alyssa-miller_46.html"	"1754"	"{""title"":""Alyssa Miller Swimsuit by Charlie by Matthew Zink 2011 Sports Illustrated Swimsuit Photo Gallery alyssa miller - maui action - 2011 sports illustrated swimsuit edition - si.com alyssa miller on si swimsuit"",""body"":""Alyssa Miller 20 was born in Los Angeles Calif and signed with a modeling agency at age 15 She has appeared on the cover of German Vogue and Italian Elle and has been featured in campaigns for Diesel and Guess This is Alyssa s first appearance in the Sports Illustrated Swimsuit Issue alyssa miller photos in maui, hawaii, from the 2011 sports illustrated swimsuit photo gallery. see alyssa miller and other models in the si swimsuit edition at si.com. alyssa miller, photos, grand wailea resort, maui, hawaii, sports illustrated swimsuit edition, si swimsuit edition, swimsuit model photo gallery, 2011, si.com alyssa miller photos in maui, hawaii, from the 2011 sports illustrated swimsuit photo gallery. see alyssa miller and other models in the si swimsuit edition at si.com."",""url"":""sportsillustrated cnn 2011 swimsuit action alyssa miller 11 alyssa miller 46 html""}"	"?"	"?"	"1.158208955"	"0.50591716"	"0.428994083"	"0.023668639"	"0"	"0.423620026"	"0"	"0"	"0.029319372"	"0"	"0.137165504"	"1.112"	"?"	"0"	"79"	"?"	"494"	"338"	"4"	"0.00591716"	"0.025"	"1"
"http://amdb10k.net/breaking-news/"	"5053"	"{""title"":""Breaking News Headlines "",""body"":""AMDB10K Where News Research Rewards News We Search copy 2011 2021 Legal AMDB10K is neither a business a charity nor a charity representative rather a general public co operative platform for publishing third party written material as marketing for sales referral to third party owned operated digital product service providers for the benefit of co operative team members and promotion of socio ecological behaviours world healing meditation endeavours and reforstation and permaculture projects Thereby neither the web site owner co operative team members or referenced charities are either responsible or liable for any third party material product service or entity news for africa,america,asia,business,entertainment,environment,europe,health,international news,middle east,music,politics,science,sport,top stories,world news breaking news,latest news,news headlines,africa,america,asia,business,entertainment,environment,europe,health,international news,middle east,music,politics,science,sport,top stories,world news"",""url"":""amdb10k breaking news""}"	"sports"	"0.504924"	"2.443983402"	"0.365517241"	"0.2"	"0.072413793"	"0.055172414"	"0.464774951"	"0"	"0"	"0.022196262"	"0"	"0.149940034"	"0.918918919"	"1"	"1"	"76"	"0"	"1078"	"290"	"2"	"0.117241379"	"0.081081081"	"0"
"http://twenty1f.com/"	"4881"	"{""title"":""Twenty1F twenty1f"",""body"":""Jul23 Francesca Lanzavecchia born in Pavia Italy in 1983 has re designed medical accessories such as neck and back braces and managed to make them incredibly sexy Francesca Lanzavecchia earned a degree in Product Design from the Politecnico di Milano In 2008 she obtained a Master degree Cum Laude in IM Conceptual Design in Context from the Design Academy of Eindhoven Her thesis project ProAesthetics Supports The Perception of Disability through its Artifacts was tutored by DROOG Design co founder Gijs Bakker Francesca s personal interpretation of design is the results of a multidisciplinary approach combining an engineering problem solver attitude with an emotional fascination for humanism Being grounded in the practical and logical she practices an agile methodology and produces provoking concepts Francesca dreams observes debates experiments designs and creates drawing upon the emotional and intangible while relating them with the real and affecting Lanzavecchia s main interest lies in the relationships objects have and can have with the human body and soul as well as having a fervent eye for future trends Wai is fascinated by the collisions and fusions of materials meanings and forms Their cooperation is based on those focuses and having hailed from two very different countries and cultures they attempt to feed off each other s backgrounds knowledge and skill sets to fuel lateral thinking and agile tangible application Dec12 Here is a fashion piece made with stretchable electronics and once combine with nano scale sensors these two allow clothing to reflect your senses or mood The body suit illustrated in the picture here has LEDs that light up according to the person s state of excitement It measures skin signals and changes light emission through biometric sensing technology Nov23 I recently learned about electronic cigarettes which allow smokers to get their nicotine fix without smoke tobacco and tar As we all know many fashion photographs in the past had their models pose with cigarettes What is interesting now is that these electronic cigarettes themselves have become a fashion item by being colorful and by having crystal LED tips which light up when the smoker inhales On top of that you can store and carry such electronic cigarette in a stylish case According to eCigarettes365 com which collects electronic cigarette reviews women prefer the pink or stainless steel models and love the crystal LEDs Oct28 BIOTEX develops bio sensing textile for health management The integration of health monitoring into textiles brings the benefits of safety and comfort Such clothes will provide remote monitoring of vitals signs diagnostics to improve early illness detection and metabolic disorder and will reduce medical and social costs The project is sposored by the European Commission To date developments in that field are mainly focused on physiological measurements body temperature electro cardiogram electromyogram breath rhythm etc with first applications targeting sport monitoring and prevention of cardiovascular risk Biochemical measurements on body fluids will be needed to tackle very important health and safety issues BIOTEX is addressing the sensing part and its electrical or optical connection to a signal processor Sep3 Recently fashion designer Willy Bogner sent his models on a trip into the future of winter sports Bogner introduced a new fashion jacket which has solar cells and is also equipped with LED lights This a new concept of a ski jacket the company is working on It should be on the market by 2018 just in time for the winter Olympics in Munich I wonder of the jacket captures solar energy to produce heat to keep the person extra warm while skiing or snow boarding electronics & fashion for the 21st century"",""url"":""twenty1f""}"	"?"	"?"	"2.133333333"	"0.655737705"	"0.213114754"	"0.196721311"	"0.196721311"	"0.491408935"	"0"	"0"	"0.078947368"	"0"	"0.271765078"	"0.013355593"	"1"	"1"	"16"	"1"	"3457"	"61"	"0"	"0.049180328"	"0.094339623"	"0"
"http://allrecipes.com/Recipe/Apple-Dumplings-II-2/Detail.aspx"	"5483"	"{""title"":""Apple Dumplings II Recipe Allrecipes com apple dumplings ii apple dumplings ii recipe from allrecipes.com"",""body"":"" whole apples are wrapped in homemade pastry, drizzled with a simple syrup and baked until tender."",""url"":""allrecipes Recipe Apple Dumplings II 2 Detail aspx""}"	"?"	"?"	"2.328502415"	"0.427777778"	"0.205555556"	"0.061111111"	"0.019444444"	"0.989795918"	"0"	"0"	"0.026812919"	"0"	"0.187438789"	"5.25"	"?"	"0"	"33"	"0"	"4791"	"360"	"5"	"0.466666667"	"0.131578947"	"1"
"http://www.dailymail.co.uk/news/article-2007972/300lbs-American-footballer-Danous-Estenor-lifts-car-save-life-trapped-truck-driver.html?ITO=1490"	"4089"	"{""title"":""300lbs American footballer Danous Estenor lifts car to save life of trapped truck driver 300lbs american footballer danous estenor lifts car to save life of trapped truck driver"",""body"":""By Mark DuellLast updated at 2 10 AM on 25th June 2011 A father of four had become stuck under the rear tyre of a Cadillac Seville while his wife screamed as she tried in vain to lift it with two other men But tow truck driver Pedro Arzola 34 was in luck as a 295lbs American footballer happened to be on hand to use all his strength and lift the car University of South Florida USF Bulls player Danous Estenor 21 a 6ft 3in offensive guard lifted the vehicle and Mr Arzola was pulled to safety Strength American footballer Danous Estenor 21 a 6ft 3in 295lbs offensive guard lifted a car and tow truck driver Pedro Arzola was pulled to safety Estenor parked his car outside the Bulls Den Caf in Tampa Florida for a bite to eat when he heard screams reported the St Petersburg Times The college sportsman saw Mr Arzola was not moving and he could not see his legs I m thinking Oh God this guy is going to die he said I tried to lift the car and when I first tried it didn t budge I backed up I don t know Estenor told the St Petersburg Times Mr Arzola s wife Maria Uribe said he was yelling for help and the scene looked like a horror movie with lots of blood Car University of South Florida Bulls player Estenor picked up a Cadillac Seville and Mr Arzola was saved by being pulled to safety file picture But Estenor added I felt this energy come and I lifted it I don t know how but somebody pulled him from the car I m thinking Oh God this guy is going to die I tried to lift the car and when I first tried it didn t budge I backed up But I felt this energy come and I lifted it I don t know how but somebody pulled him from the car Danous EstenorUSF Bulls offensive guard Mr Arzola somehow came away with only cuts bruises and a dislocated shoulder and was back on his day job just two weeks later I appreciate Estenor doing what he did saving my husband s life Ms Uribe said If nobody helps me I don t know if he is in the room right now USF strength and conditioning coach Mike Golden said he could easily name 100 NFL players who would not be able to lift up the car He just was in the right place at the right time got that adrenaline rush and got it done Mr Golden told the St Petersburg Times university of south florida bulls player danous estenor, 21, a 6ft 3in offensive guard, lifted the vehicle in tampa and tow truck driver pedro arzola, 34, was pulled to safety. 300lbs american footballer danous estenor lifts car save life trapped truck driver university of south florida bulls player danous estenor, 21, a 6ft 3in offensive guard, lifted the vehicle in tampa and tow truck driver pedro arzola, 34, was pulled to safety. 300lbs american footballer danous estenor lifts car save life trapped truck driver university of south florida bulls player danous estenor, 21, a 6ft 3in offensive guard, lifted the vehicle in tampa and tow truck driver pedro arzola, 34, was pulled to safety."",""url"":""dailymail co uk news article 2007972 300lbs American footballer Danous Estenor lifts car save life trapped truck driver html ITO 1490""}"	"sports"	"0.729559"	"4.588477366"	"0.445255474"	"0.284671533"	"0.211678832"	"0.167883212"	"0.358770718"	"0"	"0"	"0.041106719"	"0"	"0.262156988"	"0.014787431"	"?"	"1"	"30"	"0"	"12083"	"274"	"14"	"0.116788321"	"0.111320755"	"0"
"http://hypersapien.hubpages.com/_hubfc/hub/Pro-Athletes-Who-Went-Broke"	"4781"	"{""url"":""hypersapien hubpages hubfc hub Pro Athletes Who Went Broke"",""title"":""Pro Athletes Who Went Broke pro athletes who went broke"",""body"":""rate or flagPin It By HypersapienWhat Happened to the Money Sometimes you just can t help but be in awe of the salaries that pro athletes make All these millions of dollars per year to throw and catch balls shoot hoops etc But somewhat shocking is the number of these athletes who end up broke In fact it seems that many of them leave their respective leagues without a penny to their names How does that happen How do guys manage to consume in so short a span of time incomes that would last most people ten lifetimes Here are several profiles of athletes of earned princely sums during their careers and somehow threw it all away Travis HenryIn March 2007 NFL running back Travis Henry signed a 5 year 22 5 million contract with the Denver Broncos He would be cut a little more than a year later and less than a year after that he was serving a sentence of 10 years to life in prison on drug related charges including financing a drug operation Clearly his finances took something of a tumble Not helping matters was the fact that at the time he signed his contract with Denver he was already the father of 9 children with 9 different women with child support obligations of roughly 170 000 He is now purported to be the father of 11 children with 10 different women Poster available at AllPosters com Terrell OwensAlthough not a real cuddly guy you can t help but feel sorry for T O these days With the second most receiving yards in NFL history and probably a few good years left in him he can t find a job which is more a reflection on his reputation than his ability Unfortunately despite a career in which he earned over 80 million he s having serious money woes these days Looking at what he s done over his career it s clear that he overextended himself He owns a slew of homes with mortgages that amount to 750 000 annually He was under the impression that he could just rent them out if he ever needed money There were also some bad investments Apparently when you re a pro athlete those are the only kinds of investments available to you And the cherry on top 4 children by 4 different mothers with monthly child support amounting to 44 600 Allen IversonHow does a guy who earned over 150 million in his NBA career end up broke Well ringing up almost 900 000 in jewelry bills surely contributed Iverson s financial woes came to light when he was recently ordered by a judge to pay a jeweler 860 000 and he didn t have the funds to do so In other words he was spending more on jewelry than a lot of people will make in their lifetime But like many other pro athletes The Answer was prone to spending excessively This obviously included jewelry but he was also known to carry around a personal entourage of up to 50 people I don t care how much you re earning that ain t cheap And I haven t even mentioned the personal stylist Mike TysonIn his prime no one was better in the boxing ring than Mike Tyson Outside of the ring it seems that no was better than Iron Mike at spending Despite a prolific boxing career that earned him a mind boggling 300 400 million Mike Tyson is now a cautionary tale for pro athletes everywhere His financial downfall however should have come as no surprise to anyone even people as remote from him as you and I He spent lavishly and foolishly on mansions cars jewelry etc He purportedly spent 2 4 million a bathtub once And don t forget the exotic pets like tigers Who the needs a tiger Honestly But he he always was and likely always will be an enigma a true human spectacle Poster available at AllPosters com SummaryStatistics show that more than 60 of all NBA players go broke within 5 years after retiring That number is 78 for football players after leaving the NFL No matter whether you re a fan or not it s painful to see this happening to people like watching lottery winners blow a fortune within a year or two I guess when you re in your prime it feels like the good times and the money will last forever Unfortunately few things last forever certainly not your prime and definitely not the money unless you take care of it And if you re curious as to what to do with a windfall lik ebeing drafted into pro sports please see my hub on What To Do After You Win The Lottery this hub discusses several pro athletes who went broke despite earning millions in their respective sports. this hub discusses several pro athletes who went broke despite earning millions in their respective sports.""}"	"?"	"?"	"2.85483871"	"0.428571429"	"0.103896104"	"0.038961039"	"0"	"0.46393147"	"0"	"0"	"0.094736842"	"0"	"0.290880017"	"0.03379224"	"?"	"1"	"16"	"?"	"4191"	"77"	"6"	"0.324675325"	"0.13671875"	"0"
