"url"	"urlid"	"boilerplate"	"alchemy_category"	"alchemy_category_score"	"avglinksize"	"commonlinkratio_1"	"commonlinkratio_2"	"commonlinkratio_3"	"commonlinkratio_4"	"compression_ratio"	"embed_ratio"	"framebased"	"frameTagRatio"	"hasDomainLink"	"html_ratio"	"image_ratio"	"is_news"	"lengthyLinkDomain"	"linkwordscore"	"news_front_page"	"non_markup_alphanum_characters"	"numberOfLinks"	"numwords_in_url"	"parametrizedLinkRatio"	"spelling_errors_ratio"	"label"
"http://www.complex.com/city-guide/2011/07/best-hot-dog-shops-united-states"	"1033"	"{""title"":""The 25 Best Hot Dog Shops in the U S the 25 best hot dog shops in the u.s."",""body"":""Wikipedia tells us that a hot dog is a sausage served in a sliced bun It is commonly garnished with mustard ketchup onions mayonnaise relish or sauerkraut Sure We re with that And if you re looking for the simplest of dogs there are a number of places on this list that will satisfy your needs But if you want to experience next level hot dog design places where the franks are done up Italian American style and cooked in pizza dough or prepped with the rigorousness of highbrow cuisine this list might excite you more We re all coming down off the 4th of July high But probably you weren t at a BBQ where the hot dogs were topped with brisket For that sort of spin please proceed directly through Complex s list of the 25 Best Hot Dog Shops in the U S on that post-cookout food porn tip. complex.com: the original buyer\\'s guide for men. complex, complex magazine, style guide, fashion news, celebrity profiles, sneakers, sneakers guide, sneakers blog, hot_dogs on that post-cookout food porn tip. complex.com: the original buyer's guide for men."",""url"":""complex city guide 2011 07 best hot dog shops united states""}"	"?"	"?"	"1.127516779"	"0.636363636"	"0.048484848"	"0"	"0"	"0.534351145"	"0"	"0"	"0.047830923"	"0"	"0.30860043"	"0.368421053"	"1"	"0"	"15"	"0"	"4372"	"165"	"8"	"0.096969697"	"0.078431373"	"1"
"http://www.abusynest.com/2010/10/nutella-cookies.html"	"7822"	"{""title"":""A Busy Nest Four Ingredient Nutella Cookies "",""body"":""A Busy Nest Four Ingredient Nutella Cookies Four Ingredient Nutella Cookies I was thinking about the three ingredient peanut butter cookie and then I had this brilliant idea to try it with Nutella That is the kind of thought process you have when you are obsessed with the taste of Nutella Since Nutella is sweeter and slightly less solid in form than peanut butter the recipe had to be modified and became a four ingredient cookie Nevertheless it is a simple chocolate cookie with a crisp edge and chewy center Four Ingredient Nutella Cookies Printable Recipe 1 cup Nutella1 2 cup sugar1 cup all purpose flour1 eggPreheat oven to 350 degrees Blend all ingedients together well Form into 1 inch balls Place on cookie sheet Press down firmly with bottom of floured glass Bake 7 8 minutes or until set Cool "",""url"":""abusynest 2010 10 nutella cookies html""}"	"?"	"?"	"2.334975369"	"0.638132296"	"0.389105058"	"0.19844358"	"0.085603113"	"0.542857143"	"0.007407407"	"0"	"0.027705628"	"0"	"0.19327272"	"0.466666667"	"1"	"1"	"35"	"0"	"3824"	"257"	"3"	"0.26848249"	"0.107913669"	"1"
"http://www.newsnow.co.uk/"	"10119"	"{""title"":""NewsNow co uk The UK s 1 news portal "",""body"":"" newsnow.co.uk > the uk's #1 news portal newsnow, news now, news, latest headlines, breaking news, news headlines, daily news, sport, sports news, football, football news, football transfers, transfer rumours, arsenal, gunners, man u, man utd, manchester united, liverpool, tottenham, spurs, tottenham hotspurs, aston villa, birmingham city, blackburn rovers, bolton wanderers, burnley, chelsea, everton, fulham, hull city, man city, manchester city, portsmouth, stoke city, sunderland, west ham, wigan, wigan athletic, wolverhampton, wolves, celtic, rangers, hearts, current affairs, business and finance, world news, tech news, technology, entertainment news, celebrity news, press cuttings, press clippings, press monitoring, news monitoring, media monitoring, news search, email alerts, email alert, competitive intelligence, competitor intelligence, analyst research, website content, news feed, news feeds, newsfeed, newsfeeds, news topics, intranet content, aggregation, aggregator, news portal, news portals, market intelligence, competitor tracking"",""url"":""newsnow co uk""}"	"?"	"?"	"3.731182796"	"0.510638298"	"0.244680851"	"0.042553191"	"0.021276596"	"0.456953642"	"0"	"0"	"0.090573013"	"0"	"0.277868363"	"0.431818182"	"?"	"1"	"72"	"?"	"915"	"94"	"0"	"0.531914894"	"0.007092199"	"0"
"http://www.theidearoom.net/2011/01/candy-cane-heart-suckers.html"	"10207"	"{""title"":""Valentine lollipops The Idea Room "",""body"":""Want to make these fun Candy Cane Heart valentine lollipops They are really easy fun and make the perfect small gift I shared with you the other day about one of my ideas being shared in the February issue of the Family Fun Magazine Thanks for all your fun and kind comments And now that the issues are in the store I can share with you exactly what it was although MANY of you already figured it out I was contacted back in September by one of the Family Fun editors asking if they could use my Candy Cane Heart Suckers in their 2011 Valentine s Day issue They had found my idea circulating the web Pretty fun for me as I had been a big fan of their magazines for a few years now I thought I would share it with you just in case some of you don t subscribe to Family Fun And if you would like to make some for Valentine s Day here are the directions Simply take two per sucker small candy canes and place them on a greased cookie sheet in a heart shape Slide a sucker stick in between them like you see in the picture Place them in a heated 350 degree oven and watch them closely After 3 5 minutes they will be melty and bubbly Quickly remove them from the oven and pinch the ends of the candy canes together at the top and bottom of each sucker Be very careful as the candy will be HOT Then set the tray aside to cool After they have cooled completely melt some white chocolate or almond bark in the microwave Pour a small amount into the center of the suckers and smooth with your clean finger I added a few colorful sprinkles as well Let them cool again before packaging or better yet Eating Pin It make some fun and festive candy cane valentine lollipops for valentine's day. instructions and pictures with easy to follow directions."",""url"":""theidearoom 2011 01 candy cane heart suckers html""}"	"culture_politics"	"0.344041"	"2.053763441"	"0.771573604"	"0.385786802"	"0.329949239"	"0.30964467"	"0.50287687"	"0"	"0"	"0.038765823"	"0"	"0.17601314"	"0.271084337"	"1"	"1"	"14"	"0"	"10513"	"197"	"4"	"0.329949239"	"0.08"	"1"
"http://bleacherreport.com/articles/1163450-the-50-best-old-guys-in-sports-history"	"8796"	"{""title"":""The 50 Best Old Guys in Sports History best old guys in sports history\u202c"",""body"":""Age is the art of making excuses a subtle word that describes an exhausted possibly lethargic mindset But just look to the world of sports for motivation for inspiration from athletes who continue to defy the wrinkly label that has prevented so many elders from further prosperity So maybe elderly is a stretch but with 49 year old southpaw Jamie Moyer still going strong with his eighth team the Rockies we re ready to look at others who conquered their aging natures and remained dominant forces on the athletic scene Grey hair and chest high trousers didn t tarnish these careers and for that we re here to pay our respects Dinner crankiness and moth balls all before 4 p m Classic rankings\/list, multiple sports, cool lists age is the art of making excuses, a subtle word that describes an exhausted, possibly lethargic mindset. but just look to the world of sports for motivation, for inspiration from ... age is the art of making excuses, a subtle word that describes an exhausted, possibly lethargic mindset. but just look to the world of sports for motivation, for inspiration from ..."",""url"":""bleacherreport articles 1163450 the 50 best old guys in sports history""}"	"sports"	"0.584806"	"2.514851485"	"0.5"	"0.253968254"	"0.142857143"	"0.063492063"	"0.433668801"	"0"	"0"	"0.024596464"	"0"	"0.228811123"	"0.478494624"	"1"	"1"	"7"	"0"	"17082"	"126"	"7"	"0.047619048"	"0.099502488"	"0"
"http://www.pauladeen.com/recipes/recipe_view/chocolate_gooey_butter_cookies/"	"9297"	"{""title"":""Chocolate Gooey Butter Cookies Pauladeen com "",""body"":""Recipe Courtesy of Paula DeenIf the word butter is in the title you know it s gonna be good Servings 2 dozen cookiesPrep Time 10 minCook Time 15 minDifficulty Easy Ingredients Add to grocery list 1 teaspoon vanilla extract Confectioner s sugar for dusting 1 18 ounce box moist chocolate cake mix 1 8 ounce brick cream cheese room temperature 1 egg 1 stick of butter room temperature Directions Preheat oven to 350 degrees F In a large bowl with an electric mixer cream the cream cheese and butter until smooth Beat in the egg Then beat in the vanilla extract Beat in the cake mix Cover and refrigerate for 2 hours to firm up so that you can roll the batter into balls Roll the chilled batter into tablespoon sized balls and then roll them in confectioner s sugar Place on an ungreased cookie sheet 2 inches apart Bake 12 minutes The cookies will remain soft and gooey Cool completely and sprinkle with more confectioners sugar if desired Tools You May Need Show Paula s Home Cooking Watch Paula on Food Network You May Also Like These Recipes Pear Fritters View Now Cupcakes with Peanut Butter Icing View Now Popcorn Balls View Now You May Also Like These Articles Reader Comments "",""url"":""pauladeen recipes recipe view chocolate gooey butter cookies""}"	"?"	"?"	"2.336206897"	"0.526315789"	"0.210526316"	"0.090225564"	"0.037593985"	"0.545300593"	"0"	"0"	"0.046511628"	"0"	"0.208496341"	"0.631313131"	"?"	"1"	"18"	"0"	"5472"	"133"	"7"	"0.323308271"	"0.048543689"	"1"
"http://www.alternet.org/story/149193/study_confirms_that_fox_news_makes_you_stupid"	"3692"	"{""url"":""alternet org story 149193 study confirms that fox news makes you stupid"",""title"":""Study Confirms That Fox News Makes You Stupid study confirms that fox news makes you stupid | "",""body"":""A new survey of American voters shows that Fox News viewers are significantly more misinformed than consumers of news from other sources December 15 2010 Yet another study has been released proving that watching Fox News is detrimental to your intelligence World Public Opinion a project managed by the Program on International Policy Attitudes at the University of Maryland conducted a survey of American voters that shows that Fox News viewers are significantly more misinformed than consumers of news from other sources What s more the study shows that greater exposure to Fox News increases misinformation So the more you watch the less you know Or to be precise the more you think you know that is actually false This study corroborates a previous PIPA study that focused on the Iraq war with similar results And there was an NBC Wall Street Journal poll that demonstrated the break with reality on the part of Fox viewers with regard to health care The body of evidence that Fox News is nothing but a propaganda machine dedicated to lies is growing by the day In eight of the nine questions below Fox News placed first in the percentage of those who were misinformed they placed second in the question on TARP That s a pretty high batting average for journalistic fraud Here is a list of what Fox News viewers believe that just aint so 91 percent believe the stimulus legislation lost jobs 72 percent believe the health reform law will increase the deficit 72 percent believe the economy is getting worse 60 percent believe climate change is not occurring 49 percent believe income taxes have gone up 63 percent believe the stimulus legislation did not include any tax cuts 56 percent believe Obama initiated the GM Chrysler bailout 38 percent believe that most Republicans opposed TARP 63 percent believe Obama was not born in the U S or that it is unclear The conclusion is inescapable Fox News is deliberately misinforming its viewers and it is doing so for a reason Every issue above is one in which the Republican Party had a vested interest The GOP benefited from the ignorance that Fox News helped to proliferate The results were apparent in the election last month as voters based their decisions on demonstrably false information fed to them by Fox News By the way the rest of the media was not blameless CNN and the broadcast network news operations fared only slightly better in many cases Even MSNBC which had the best record of accurately informing viewers has a ways to go before it can brag about it The conclusions in this study need to be disseminated as broadly as possible Fox s competitors need to report these results and produce ad campaigns featuring them Newspapers and magazines need to publish the study across the country This is big news and it is critical that the nation be advised that a major news enterprise is poisoning their minds This is not an isolated review of Fox s performance It has been corroborated time and time again The fact that Fox News is so blatantly dishonest and the effects of that dishonesty have become ingrained in an electorate that has been been purposefully deceived needs to be made known to every American Our democracy cannot function if voters are making choices based on lies We have the evidence that Fox is tilting the scales and we must now make certain its corporate owners do not get away with it Mark Howard is an artist and author and the publisher of News Corpse alternet.org, independent media, alternative news, media activism, the drug war a new survey of american voters shows that fox news viewers are significantly more misinformed than consumers of news from other sources.""}"	"culture_politics"	"0.876315"	"3.81420765"	"0.58974359"	"0.261538462"	"0.179487179"	"0.107692308"	"0.452855972"	"0"	"0"	"0.029478458"	"0"	"0.18617634"	"0.059485531"	"?"	"1"	"45"	"0"	"4370"	"195"	"9"	"0.112820513"	"0.106180666"	"0"
"http://www.collegefashion.net/beauty-and-hair/i-tried-it-magnetic-nail-polish/"	"6928"	"{""title"":""I Tried It Magnetic Nail Polish College Fashion "",""body"":""Written by Elizabeth University of Missouri There s always a new trend in the world of nail polish greige Yellow Konad Neon Crackle Duochrome Nail Polish Strips Ombre and it can get hard to keep track of all of them However when Vogue dedicates an entire article in its October issue to one of these trends you know it s here to stay cue magnetic nail polish Although it s been available in Europe for the past few years it only recently became available stateside The formula actually has magnetic particles in it and when you hold a magnet conveniently located on the polish bottle cap over your nail the polish ripples and creates a 3 D effect Yeah yeah that s all great but does it actually work Here is my review of nails inc Magnetic Nail Polish The Product I purchased the nails inc polish from Sephora at 16 a bottle it is definitely not cheap so I hoped it would be great to justify eating up my weekly coffee budget There were only two options on Sephora s site Houses of Parliament a purple and Trafalgar Square a silver chrome the latter of which I bought The bottle itself comes with an overcap with a magnet on top which makes it easy to apply My only issue with the bottle is that the directions on the bottle are solely in French so they re useless for the majority of US customers thankfully that s what this instructional video on the Sephora YouTube channel is for My Attempt Applying this product is simple You apply the first coat like any other polish and as I hoped the nails inc formula was opaque pigmented and quick drying The next part is trickier After your first coat is dry apply a liberal amount of polish for your second coat Immediately after take the overcap with the magnet and place it above your nail making sure not to touch your wet polish and wait for 10 20 seconds and poof Instead of silver nails you ll have 3D ish black chevron patterned nails Obviously you repeat the process with each nail It sounds time consuming but I promise it isn t it ll take maybe 10 minutes longer than another manicure I d wait twice as long as you usually do before putting a top coat on though as putting it on too soon can ruin the design My Verdict I absolutely love love love the magnetic effect literally I have not been able to stop staring at my nails If you re adventurous with your polish then I d totally splurge on this I promise people will want to know what s on your nail and how you did it However I did have some complaints with the product though One the magnet will basically make the same pattern on each nail moving the magnet around won t yield any results Also you only really have one chance to do it right if you mess up somehow you have to take off both layers and start from the beginning Is it worth the 16 Yes if you re into flashy nails Personally I really love this trend and I ll definitely be rocking this in the fall winter will you What do you think about magnetic nail polish Would you try this trend What s your favorite crazy nail trend Tell me everything in the comments Posted on on October 21 2011 Filed Under Beauty Hair Tags chrome I Tried It magnetic nail polish nail art Nails nails inc magnetic nail polish nails inc a review of the nails inc. magnetic nail polish, with photos of the results and a step-by-step application guide, plus info on whether the formula works as promised. magnetic polish, magnetic nail polish, magnetic polish trend, magnetic nail polish trend, nails inc magnetic polish, magnetic nail polish review"",""url"":""collegefashion beauty and hair i tried it magnetic nail polish""}"	"?"	"?"	"3.265306122"	"0.636363636"	"0.404040404"	"0.262626263"	"0.121212121"	"0.468955651"	"0"	"0"	"0.043478261"	"0"	"0.234063561"	"0.094720497"	"1"	"1"	"14"	"0"	"8663"	"99"	"7"	"0.050505051"	"0.093097913"	"0"
"http://www.healthcentral.com/sleep-disorders/cf/slideshows/7-snacks-to-eat-before-bed-for-better-sleep/chamomile-tea?ap=831"	"4783"	"{""title"":""Chamomile tea 7 Snacks to Eat Before Bed for Better Sleep "",""body"":""By using this service you accept our Terms of Use Please read them The consumer health information on is for informational purposes only and is not a substitute for medical advice or treatment for any medical conditions You should promptly seek professional medical care if you have any concern about your health and you should always consult your physician before starting a fitness regimen Copyright 2012 Remedy Health Media LLC All Rights Reserved this is a bedtime favorite because it has a mild sedating effect. &nbsp; source: foods to help you sleep better and lose weight"",""url"":""healthcentral sleep disorders cf slideshows 7 snacks to eat before bed for better sleep chamomile tea ap 831""}"	"health"	"0.991382"	"1.722222222"	"0.252336449"	"0.046728972"	"0.009345794"	"0"	"0.62283737"	"0"	"0"	"0.052873563"	"0"	"0.263929136"	"0.221052632"	"?"	"0"	"49"	"0"	"879"	"107"	"12"	"0.224299065"	"0.068376068"	"1"
"http://naturalpapa.com/review/clean-disinfect-tap-water-activeion-hom/"	"2989"	"{""title"":""Clean and Disinfect with Tap Water The Activeion Hom clean and disinfect with tap water: the activeion hom"",""body"":null,""url"":""naturalpapa review clean disinfect tap water activeion hom""}"	"science_technology"	"0.747563"	"2.872881356"	"0.591666667"	"0.266666667"	"0.133333333"	"0.075"	"0"	"-1"	"0"	"0.065957447"	"0"	"0.265870884"	"-1"	"1"	"1"	"30"	"0"	"3868"	"120"	"7"	"0.083333333"	"0.153846154"	"1"
"http://www.lovefromtheoven.com/2011/03/21/chocolate-covered-smores-pops/"	"4981"	"{""title"":""Chocolate Covered Smores Pops "",""body"":""I don t spend much time around campfires and I do not have a fireplace so smores are a treat that I do not get to enjoy often enough They are such a winning flavor combination ooey gooey creamy marshmallows crunchy graham crackers and of course the delicious melty chocolate So if this girl wants smores she has to improvise a bit and whip them up in the oven I think I have found one heck of a great way to do just that Smores Pops Here s what you need for your indoor smores pops Pretty simple graham crackers marshmallows and chocolate You can also use graham cracker crumbs or sprinkles if you like There is really no scientific formula and you could use miniature marshmallows big marshmallows homemade marshmallows heck you can even use marshmallow fluff Have fun and use what you have Prepare your work area with some wax paper Because I was using full size marshmallows I decided to cut them in half You could do this with a knife kitchen shears a pizza cutter or you could probably even just tear them apart I went with the pizza cutter route A bit sticky but it got the job done After cutting your marshmallows you will want to sit them on your graham crackers I used one large marshmallow per smore You could use more it s really up to your personal taste You can heat your marshmallows two different ways microwave or oven While I love the roasted tops of the marshmallows from the oven honestly for the smore pops I think the microwave works better It makes the marshmallows sticky enough on both sides so that they bind to the graham crackers nicely If you use the microwave it only takes a few seconds literally The marshmallows above were in the microwave less than five seconds Those babies puff up FAST If you put the marshmallows in the oven as shown above without the top graham cracker on them you will have to work a bit more to get the top graham cracker to stay in place I achieved this by smooshing the gooey marshmallow around the sides Sometimes you just gotta do what you gotta do I m thinking that if you put the top marshmallow on before putting it in the oven the grahams will stay put though you will lose a bit of the crunchy cooked marshmallow taste I baked this tray of marshmallows for about 2 3 minutes at 425 degrees After they come out of the oven or microwave you will want to get the top graham crackers onto the marshmallows quickly You will have some ooze out the sides but that s okay The entire thing is going to be covered in chocolate so neatness really isn t a concern After putting the tops on you can slip your sticks into the marshmallows You can skip this part if you don t want to go the pop route After putting the graham cracker tops on and inserting the sticks you will want to let these set up for a bit An hour is enough time you just want the marshmallows to firm back up a bit Once the marshmallows are set up you can melt your chocolate Follow the directions on your package of chocolate You will want to make sure the melted chocolate cools a little bit before dipping otherwise you ll have a gooey mess But a delicious one I don t actually dip mine as I never have that much chocolate I use a small bowl and do a combo of dipping in chocolate and spooning on the chocolate Make sure to tap tap tap to get the excess drippy chocolate off Not that excess chocolate is ever a bad thing but it can be quite a mess After dipping in chocolate you can sprinkle the tops with graham cracker crumbs graham cracker chunks chocolate chips sprinkles or whatever else your little heart desires I sit mine on wax paper and let the chocolate set for an hour or so The time for the chocolate to set will vary based on the chocolate you use how hot it is the weather and possibly your astrological sign Okay maybe not that last one After that you are ready to ENJOY These are crazy good plain and simple Yum Smores on a stick Smores pops One thing that could make these even more outrageous would be to add in chocolate to the center of the smore I m going to have to give that a try next time I make them Without a stick Still JUST as tasty When I leave out the stick I do not completely cover them in chocolate Mainly because I don t want to get my hands all covered in chocolate I have a weird OCD issue with that I m a big fan of nice clean hands but that s another story And if you have the willpower to not devour them all in one sitting and can manage to give some away simply adding a cellophane bag and some ribbon will create a cute gift or favor Quick delicious and no campfire required However If you prefer you can sit around and sing kum ba yah and pretend you have that campfire part I m pretty much satisfied with the chocolate part though graham crackers and marshmallows are covered in chocolate and served on a stick for these easy and delicious smores pops. smores, smores recipe, indoor smores, oven smores, smores pops, chocolate graham crackers, chocolate covered smores"",""url"":""lovefromtheoven 2011 03 21 chocolate covered smores pops""}"	"recreation"	"0.625311"	"1.852272727"	"0.336633663"	"0.217821782"	"0.158415842"	"0.128712871"	"0.414051427"	"0"	"0"	"0.053359684"	"0"	"0.252102467"	"0.045989305"	"1"	"1"	"11"	"0"	"5431"	"101"	"4"	"0.01980198"	"0.106164384"	"1"
